id,name,year,episode,song,artist
711054,vai que cola: o filme,2015.0,,vem cá fazer um love,buchechinha+giulie oliveira+buchecha
455072,gonzo: the life and work of dr. hunter s. thompson,2008.0,,ballad of a thin man,bob dylan
443085,forev,2013.0,,kill me,greg kozo+pierre mathieu+make the girl dance
134182,las vegas,2003.0,new orleans (#1.16),operate,peaches
99270,glenn miller time,1961.0,(#1.10),moonlight serenade,glenn miller+johnny desmond+his orchestra
380373,burlesque assassins,2012.0,,the highjack jump,johnny summers+chris andrew+kodi hutchinson
403262,daddys dyin... whos got the will?,1990.0,,harder than your husband,frank zappa+beverly dangelo
293519,this is tom jones,1969.0,(#3.5),teach your children,graham nash+liza minnelli
486930,is anybody there?,2008.0,,im in the mood for love,vera lynn+jimmy mchugh  / dorothy fields
378800,brusten himmel,1982.0,,the night is young and youre so beautiful,dana suesse
143879,lua vermelha,2010.0,(#1.28),ai se ele cai,xutos e pontapés
209655,she-ra: princess of power,1985.0,enchanted castle (#1.19),i have the power,erika scheimer+noam kaniel+shuki levy+haim saban
476427,how to die in oregon,2011.0,,horizon variations,max richter
719312,weekend,2011.0,,were so light,tom havelock/marcus efstratiou+hook+the twin
550026,my gun is quick,1957.0,,blue bells,marlin skiles+stanley styne
316453,we bare bears,2014.0,pandas date (#1.5),ill be your friend,brad joseph breeck
89712,fleabag,2016.0,pilot (#1.1),dangerous girl,andrew taylor
398049,convention city,1933.0,,hail! hail! the gangs all here,theodore morse+arthur sullivan
616599,singles,1992.0,,battle of evermore,jimmy page+robert plant+the lovemongers
702296,travelling light,2003.0,,sunshine of your love,jack bruce+pete brown+eric clapton+cream
99360,glückliche reise,1992.0,thailand (#2.1),lets make it,costa cordalis+lucas cordalis+kiki cordalis
392039,chutney popcorn,1999.0,,teenage angst at 27,tamala poljak+longstocking
143485,lua vermelha,2010.0,(#1.22),sangue oculto,gnr
124257,jersey shore,2009.0,great meatballs of fire (#6.7),blackout,bert selen+zack arnett
680485,the raid 2: berandal,2014.0,,suck it up,joseph trapanese+aria prayogi+fajar yuskemal
56677,dance moms,2011.0,the girls say goodbye (#6.21),we on top,photronique+shari short
92232,friday night football,2002.0,round 8: geelong vs carlton (#14.8),in the heat of the moment,noel gallaghers high flying birds+noel gallagher
301281,top of the pops,1964.0,(1980-10-16),woman in love,barbra streisand
618139,slacker,1991.0,,killer rockers,brent bingamon+pocket fisherman
338510,abo so,2013.0,,bida un ta pa largo,michelangelo joel koolman
439828,fiorile,1993.0,,rock mediceo,
731186,yume to kyôki no ôkoku,2013.0,,tsumugi kaze (yume tsumugi),
617234,siu lam juk kau,2001.0,,ti chu ge wei lai,jacky chan+andy lau
244663,the footy show,1994.0,the 500th footy show (#18.5),sweet georgia brown,brother bones+his shadows+ben bernie+maceo pinkard+kenneth casey
22965,barend en van dorp,1990.0,(2000-04-22),a whiter shade of pale,keith reid+gary brooker+matthew fisher
555949,nick and norahs infinite playlist,2008.0,,insistor,josh grier+tapes n tapes
255611,the match game,1962.0,paula prentiss & don defore (#2.144),a swingin safari (the match game),bert kaempfert
518917,lightning bug,2004.0,,jimmy stewart,tom clark
81218,elementary,2012.0,snow angels (#1.19),sean callery,sean callery
326599,10 años con bebe,2016.0,,desconfías,bebe
673870,the miracle of life,2013.0,,the miracle of life original theme,yuri lewitt
186803,pretty little liars,2010.0,exes and omgs (#7.8),cold blood,valen
138223,lie to me,2009.0,pilot (#1.1),easier to lie,
54533,cybill,1995.0,how can i call you my ex-husbands if you wont go away? (#1.2),i just called to say i loathe you,christine baranski
279893,the tony danza show,2004.0,(#1.1),new york  new york,john kander+fred ebb+liza minnelli
640433,te wu mi cheng,2001.0,,gong don ci,liu xue an+cao xue qin+vivian hsu
37762,buffy the vampire slayer,1997.0,homecoming (#3.5),jodi foster,the pinehurst kids
718861,we will rock you: queen live in concert,1982.0,,we are the champions,freddie mercury
215809,so you think you can dance canada,2008.0,top 10 performance (#4.18),to build a home,patrick watson+jason swinscoe+phil france+stella page+the cinematic orchestra
106109,hannibal,2013.0,coquilles (#1.5),adagio: from concerto for clarinet & orchestra in a major k622,wolfgang amadeus mozart
470042,high hat,1929.0,,nobodys sweetheart,billy meyers+elmer schoebel
16763,arrow,2012.0,tremors (#2.12),arrow end theme,blake neely
705857,two scents worth,1955.0,,sobre las olas (over the waves),juventino rosas
90960,fortitude,2015.0,(#1.9),peeling off the layers,wildbirds+peace drums
109198,het klokhuis,1988.0,martin kers - landschapsfotograaf,landschapsfotograaf,harry bannink+frank groothof
23666,bassie en adriaan en het geheim van de sleutel,1978.0,een dagje vissen (#1.9),kapitein bassie,bas van toor+aad van toor+rinus van galen
204618,scream queens,2015.0,the final girl(s) (#1.13),waterfalls,marqueze etheridge+lisa left eye lopes+organized noize+tlc
11049,american horror story,2011.0,i am anne frank: part 2 (#2.5),dominique,soeur sourire+noel regney
452543,girls aloud: girls on film,2005.0,,love machine,girls aloud
65899,deixa-me amar,2007.0,(#1.18),o fado da procura,ana moura
702413,treasure of tayopa,1974.0,,train of thought,garn littledyke
267144,the simpsons,1989.0,$pringfield (or how i learned to stop worrying and love legalized gambling) (#5.10),giant killers,len stevens
565316,ondho prem,1993.0,,ke hobe amar deewana,runa laila+ahmed imtiaz bulbul
656614,the disco ball,2003.0,,total eclipse of the heart,jim steinman+nicki french
104685,guapas,2014.0,psicopatología 1 (#1.40),bizarre love triangle,angie hart
726385,wolves,2014.0,,bad dog,stefan zillouz+martin reinsel+jon newman+gravelroad
545633,mostly ghostly,2008.0,,big show,peter neff+ed roscetti
539928,michael jackson: the life of an icon,2011.0,,ill be there,willie hutch+hal davis+bob west+berry gordy+jackson 5
207551,shameless,2011.0,a great cause (#2.10),the naked flame,ivan julian
54992,dag,2010.0,do you want me to plug it in? (#4.2),gotta take a selfie,
605071,savannah smiles,1982.0,,the getaway,
179755,patriot,2015.0,,train song,jennifer vashti bunyan+alasdair+vashti bunyan
650257,the boat that rocked,2009.0,,crimson and clover,tommy james+peter p. lucia jr.+the shondells+arrangement with warner music group film+tv licensing
711486,vampire academy,2014.0,,sinful nature,jon philpot+joe stickney+adam wills+bear in heaven+arrangement with bank robber music
393924,clockwatchers,1997.0,,rileys theme,joseph l. altruda+joey altruda+his cocktail crew
74983,doremix,2012.0,patricio manns: arriba en la cordillera (#1.9),arriba en la cordillera,patricio manns
679454,the princess & the marine,2001.0,,wannabe,spice girls+matt rowe+richard stannard
401418,cruising,1980.0,,spy boy,john hiatt
597634,rocky,2006.0,,laagi chhute na - remix,himesh reshammiya+sameer
101167,gossip girl,2007.0,the undergraduates (#4.3),on the run,the lost patrol
328503,20th annual music city news awards,1986.0,,it aint easy being easy,janie fricke
372854,bodywork,2001.0,,hamfist,morgan nicholls
253724,the marty stuart show,2008.0,lyle lovett (#4.25),white freightliner blues,townes van zandt+lyle lovett+marty stuart+keith sewell+luke bulla
709434,university heights,2004.0,,killjoy,burn disco burn
501657,king of jazz,1930.0,,dye ken john peel,a male quartet during the melting pot of music production number
435762,faith,2008.0,,wait,david bowick
724960,will power,1936.0,,chopsticks,euphemia allen
29298,bem-vindos a beirais,2013.0,santos da casa (#1.12),muda de vida,antónio variações+humanos
89800,flight of the conchords,2007.0,newzealandtown (#2.8),fashion is danger,jemaine clement+bret mckenzie
306813,tu cara me suena,2011.0,(#3.13),nada cambiará mi amor por ti,gerry goffin+michael masser+xuso jones
231201,t in the park 2015,2015.0,noel gallaghers high flying birds (#1.49),riverman,noel gallagher+noel gallaghers high flying birds
229174,suomilove,2014.0,(#2.10),kuka pysäyttäisi kellot,jussu pöyhönen+kari hurri+pekka hakala
509721,la última noche,1948.0,,oriental,manuel esperón
225842,stars in their eyes,1990.0,(#11.1),the race is on,don rollins+chris sibley
334837,a new york story,,,outside this town,ryan jarvis
592776,resan till dej,1953.0,,et lille kÆrtegn / en klapp pÅ kinden,ulrik neumann+alice babs
43133,castle,2009.0,little girl lost (#1.9),get what i want,bitter:sweet
98924,glee,2009.0,sadie hawkins (#4.11),i dont know how to love him,andrew lloyd webber+jenna ushkowitz
248110,the hollywood squares,1965.0,(#1.149),the silly song (the theme of the hollywood squares),james jimmie haskell
373452,booby hatched,1944.0,,it looks like a big night tonight,egbert van alstyne
672880,the mansion,2013.0,,rca (+),daniel segerstad+johannes hedberg+carbon-based lifeforms
548829,musicalment,2008.0,,ja surt el sol,george harrison
722089,when the cats away,1929.0,,oh du lieber augustin,
537400,mega snake,2007.0,,if it takes all night,jonathan martin gordon+scott schreer
486858,irren ist männlich,1996.0,,for loves sake,péter wolf+michelle giglio+bill chapman
297534,tohuwabohu,1990.0,historobohu (tohu 1-7 bzw. 50) (#8.8),surfin usa,chuck berry+the beach boys
680388,the rachel papers,1989.0,,tears,frankie knuckles
321634,x factor,2008.0,(#3.14),fascination,alphabeat+linda andrews+thomas ring+tine midtgaard+jesper nordstedt boesgaard
173218,one tree hill,2003.0,last known surroundings (#9.7),take your time,cary brothers
710746,vh1 divas 2012,2012.0,,groove is in the heart,dmitry brill+herbie hancock+q-tip+lady miss kier+towa tei+natasha bedingfield+iggy azalea+bootsy collins
471939,holidays,2016.0,,shamrock,jaime wyatt+jane sheldon+jonathan sheldon+american bloomers
203126,saturday night live,1975.0,scarlett johansson/death cab for cutie (#31.10),fly high  duluth,will forte+scarlett johansson
625500,sparrows dance,2012.0,,village of love,devora brown+nathaniel mayer+the fabulous twilights
623395,sonshine,2016.0,,dont play,deshon bullock+joshua crosby+shonlock+ryan clark
200538,sam & cat,2013.0,#mommagooma (#1.9),whole night to party,michèle vice-maslin+ichiro suezawa+deanna della cioppa
62339,de que te quiero  te quiero,2013.0,la ambición de brigitte (#1.173),amor  amor,jorge octavio domínguez+octavio lara+yuri+manuel mijares
671986,the machinist,2004.0,,susan in the summer,john sbarra
261963,the porter wagoner show,1961.0,rusty draper & guy drake (#1.281),my blue ridge mountain boy,dolly parton
392,100 greatest songs of the 90s,2007.0,(#1.5),losing my religion,r.e.m.
593526,revenge of the mekons,2013.0,,after 6,
651975,the byron janis story,2010.0,,ballade #1 in g minor,frédéric chopin+byron janis
28781,bem-vindos a beirais,2013.0,a cabala (#4.107),muda de vida,antónio variações+humanos
403587,dairantô sumasshu burazâzu ekkusu,2008.0,,meta knights revenge,jun ishikawa
529782,madonna: the mdna tour,2013.0,,express yourself,madonna+stephen bray+pharrell williams+lady gaga+jeppe breum laursen
349823,angelina ballerina: shining star trophy movie,2011.0,,it takes a lot of dancers,charlotte spencer
506643,la mission,2009.0,,reina de mi alma,music courtesy of round world music
201264,saturday night live,1975.0,alec baldwin/paul mccartney (#18.13),biker like an icon,paul mccartney
435423,faces in the crowd,2011.0,,a funky way of things,george acogny+wolfgang aichholz
219928,sons of anarchy,2008.0,to thine own self (#5.11),true blue,michael sackler-berner
699213,tomorrow never dies,1997.0,,it had to be you,isham jones+gus kahn+simon greenaway
445200,free willy 2: the adventure home,1995.0,,forever young,rebbie jackson+arrangement with sony music licensing
685116,the sonnet trilogy: times best jewel,2013.0,,variations on an original theme for orchestra (,edward elgar
696053,three in the attic,1968.0,,paxton quigleys had the course,chad stuart+jeremy clyde+chad+jeremy
524213,lost on purpose,2013.0,,tinsel town,peter donovan+all the real girls
185360,popular,1999.0,,supermodels,kendall payne
216822,so you think you can dance,2005.0,the top eight perform (#6.21),too much booty 2,soundmaster t+jah-rista+korveil
43638,celebridade,2003.0,(2003-10-13),i heard it through the grapevine,norman whitfield+barrett strong+michael mcdonald
433392,evensong,1934.0,,i wait for you,mischa spoliansky
265282,the ren & stimpy show,1991.0,space dogged/feud for sale (#5.2),romeo & juliet overture,pyotr ilyich tchaikovsky
140824,local ambition,2013.0,2nd cut is the deepest (#3.4),sunny d,bad neighborz
509876,lacrimosa: the live history,2000.0,,kabinett der sinne,lacrimosa
57936,dancing with the stars,2004.0,2011 grand finale (#11.10),dancin fool,barry manilow
121092,interaktiv,1993.0,tv allstars x-mas special,reason,no angels
280183,the tribe,1999.0,(#4.17),tribe spirit,raymond thompson+meryl cassie+monique cassie+megan alatini
84387,esupâ mami,1987.0,kandou shinai meiga (#1.72),fushigi angel,keiichi oku+ushio hashimoto
308392,ugly betty,2006.0,crushd (#3.7),get on with it,val emmich
183006,poketto monsutâ - daiyamondo pâru,2006.0,loud roar! jibacoil vs metagross!! (#1.158),saikô eburidei!,fumie akiyoshi+kazumi mitome
131808,lax - follow the black pony,2010.0,mad world (#1.7),ultimatum,ben bledsoe+michael johnson+will champlin+the black pony
124498,jimmy kimmel live!,2003.0,(#8.15),youre everyone i know right now,the lives of famous men
480927,im not there.,2007.0,,the lonesome death of hattie caroll,mason jennings+bob dylan
30988,big time rush,2009.0,big time prom kings (#2.19),nothing even matters,robert larow+jonathan perkins+damon sharpe+jimmy burney+jeremy skoller+big time rush
181813,pinky and the brain,1995.0,around the world in 80 narfs (#1.10),the daring young man on the flying trapeze,alfred lee+gaston lyle
451657,gib gas - ich will spaß!,1983.0,,schön sind wir sowieso,markus mörl
149515,mary tyler moore,1970.0,we want baxter (#4.12),love is all around,sonny curtis
511448,las adolescentes,1975.0,,la gaviota,juan carlos calderón+mocedades
566714,onnellisten laiva,2004.0,,rockin down to mellow,kauko röyhkä+vuokko hovatta+the perfectoes
40249,californication,2007.0,,keep on,- champion
459606,growlanser iii: the dual darkness,2001.0,,to your tomorrow,
135407,late show with david letterman,1993.0,(#18.107),theme from hawaii five-o,morton stevens+the cbs orchestra
161227,music in high places,2000.0,alanis morissette: navajo nation - arizona  usa,i was hoping,alanis morissette+glen ballard
255028,the match game,1962.0,(#6.155),the match game,the score production band
634357,summertime blues: lemon popsicle viii,1988.0,,lets twist again,kal mann+dave appell+chubby checker
531842,mambo italiano,2003.0,,melao de cana,pedroso ferrer hipolita merced+carole fleury
671829,the loved ones,2009.0,,snuff is my business,black like vengeance
673920,the mischievous shoes,,,the mischievous shoes,the arbitrary jukebox experiment
75020,doruâga no tô: the sword of uruk,2009.0,the land of shadows (#1.5),questions?,yû nakamura
580792,porn punk poetry,2014.0,,happy birthday,david schütter
190833,radio 1s big weekend norwich 2015,2015.0,fall out boy (#1.9),dance  dance,fall out boy
154197,mike and mike in the morning,2005.0,(2015-09-25),birthday,john lennon+paul mccartney+the beatles
22643,bandstand,1952.0,(#9.15),begin the beguine,cole porter+nino tempo+april stevens
507409,la doppia ora,2009.0,,east hastings,godspeed you! black emperor
590526,realm of souls,2013.0,,2:30 train,fishing with dynamite
63613,degrassi: the next generation,2001.0,dont stop believing (#7.22),in a matter of speaking,tony ivarson+martin berndtsson+martin engvall+jens faltman+the leslies
427689,el pecador,1965.0,,no tengo edad,nisa+mario panzeri
164650,na vode,2016.0,notebook (#1.3),tam za vodou v rákosí,karel mares+lyrics by jirí staidl+waldemar matuska+eva pilarová
445914,friday night lights,2004.0,,barbara ann,fred fassert
513601,le hasard fait bien les choses,2002.0,,pourvu quil me laisse le temps,lorianne cherpillod
443174,forevers end,2013.0,,jigsaw,mimi page+charity farrell+lili reinhart
38899,cmt top 20 countdown,2001.0,(2007-11-10),take me there,rascal flatts
137386,les secrets de la mer rouge,1968.0,lenquête (#2.10),les pirates,françois de roubaix  et orchestre
601502,ssx tricky,2001.0,,bonecracker,shocore
453756,go west  young lady,1941.0,,ida red,wava white
516319,les mauvais joueurs,2005.0,,love goes on,edgard jaude+curtis richardson
444959,freddy got fingered,2001.0,,ride of the valkyries,richard wagner+wiener philharmoniker
48906,conan,2010.0,one if by land  two if by a slightly longer land-route (#1.17),not the drinking,lauren pritchard+eg white
519748,lisztomania,1975.0,,excelsior song,franz liszt+paul nicholas
136526,later... with jools holland,1992.0,(#4.3),when the levee breaks,jimmy page+robert plant+john paul jones+john bonham
472741,hollywood in vienna 2012,2012.0,,once upon a time in the west,ennio morricone+orf radio-symphonieorchester wien
398835,cosmopolis,2003.0,,ghetto defendant,the clash
227319,strictly come dancing,2004.0,week one: show one (#8.2),cosmic love,florence welch+isabella summers+florence+the machine
114425,how i met your mother,2005.0,the locket (#9.1),across the overpass,the solids
218521,soltera otra vez,2012.0,la primera vez (#1.15),algo,déborah de corral
374073,born romantic,2000.0,,pintame,elvis crespo+kind permission of sony/atv music publishing limited
57768,dancing with the stars,2004.0,(#9.2),true colors,tom kelly+billy steinberg
199469,s.p.u.n.g,2002.0,jag kommer aldrig att älska lika mycket som nu (#1.9),apart,perry bamonte+simon gallup+bob smith+porl thompson+boris williams+the cure
364203,bell witch: the movie,2007.0,,amazing grace,john newton
384147,cantinflas,2014.0,,ríete de amor hasta que mueras,
35884,britains got more talent,2007.0,(#10.9),get the party started,pink
565782,one kine day,2011.0,,running,sdib
629616,stealing time,2009.0,,welcome christmas,albert hague
458523,grease,1978.0,,we go together,jim jacobs+warren casey+john travolta+olivia newton-john+cast
703393,tropic thunder,2008.0,,escalation,marc ferrari+matt hirt
1614,20 to 1,2005.0,our all time favourite films (#9.11),i like that,richard humpty vission+static revenger starring luciana caporaso+dennis g. white+luciana caporaso+nicholas clow
635175,super troopers,2001.0,,whos the king (you know thats me),joseph henry+phillip lehman+alexander roth
240613,the chisholms,1979.0,the promised land (#2.6),billy the kid,aaron copland
300035,top of the pops,1964.0,(1978-10-26),teenage kicks,john oneill+the undertones
612450,sheryl crow: rockin the globe live,2000.0,,everyday is a winding road,sheryl crow+jeffrey trott+brian macleod
361637,battlefield enforcement,2018.0,,chale aa re (the request for help) (poem),prashast singh
360638,barney: lets go to the beach!,2002.0,,mr. sun,barney+friends
336587,a very merry mix-up,2013.0,,the first noël,
432913,eurovision laulukilpailu 1976 - suomen karsinta,1976.0,,mustalaiskaravaani,deszö balogh+anneli sari
144864,luck,2011.0,(#1.1),splitting the atom,massive attack
642619,thanks for listening,1937.0,,i like to make music,connie lee+al heath+buddy la roux+pinky tomlin
41739,canadian idol,2003.0,top 7 performances (#2.22),hello,lionel richie+theresa sokyrka
495990,just married: marriage was only the beginning!,2007.0,,jaagte raho,gulzar+sonu nigam+pritam chakraborty
680105,the pursuit of d.b. cooper,1981.0,,you were never there,waylon jennings+jessi colter+michael smotherman
120722,indonesian idol,2004.0,workshop 3 - grup 3 (#1.12),setia,bona sardo hasoloan hutahaean
263420,the ren & stimpy show,1991.0,blazing entrails/lumber jerks (#4.3),une nuit au cabaret,victor cavini
216620,so you think you can dance,2005.0,results show: winner announced (#4.23),burnin up,nicholas jonas+joe jonas+kevin jonas+the jonas brothers+robert feggans
629155,stash,2007.0,,working man from texas,mark schoenrock+blues effect
361934,be somebody... or be somebodys fool!,1984.0,,styling,greg poree
98571,glee,2009.0,guilty pleasures (#4.17),mamma mia,benny andersson+björn ulvaeus+stig anderson+lea michele+chris colfer+naya rivera+becca tobin+melissa benoist+chord overstreet+darren criss+alex newell
634727,sunset in wyoming,1941.0,,twenty-one years,bob miller
647678,the banger sisters,2002.0,,doctor my eyes,jackson browne+ben folds
603630,santa maradona,2001.0,,santa maradona,manu chao+mano negra
487682,it happened to jane,1959.0,,it happened to jane,
617813,ski school 2,1994.0,,tough love,john kekar+steve parrish+spank the blond
431879,eröffnung der wiener festwochen 2012 - eurovision young musicians 2012,2012.0,,concerto for qanun and orchestra no. 2 e-major,khachatur avetisyan+narek kazazyan+radio-symphonieorchester wien
567368,orange mittai,2015.0,,payanangal thodarudhae,kattalai jaya+naresh iyer+padmalatha
332147,a claymation christmas celebration,1987.0,,joy to the world,
301079,top of the pops,1964.0,(1980-04-24),my oh my,sad café
384136,cantautores desde la libertad,2005.0,,a cántaros,pablo guerrero
546502,mr. & mrs. smith,2005.0,,(who discovered) america,jason roberts+william abers+raul pacheco+justin poree+ozomatli
661155,the game,2008.0,,teleportation music,antome
318945,wilderness point bible camp,2013.0,2013: day 1 (#1.1),star gazing,dino
726354,wolfgang ambros: greatest hits  ...so far!,2003.0,,tagwache,joesi prokopetz+wolfgang ambros
174720,open bar,2010.0,(#1.8),deixa disso,felipe dylon
45004,cheias de charme,2012.0,(#1.65),cha la la,leandra leal
454698,golden earrings,1947.0,,maros vize folyik csendesen,
135871,late show with david letterman,1993.0,(#20.71),long live a$ap,rakim mayers
516949,let it shine,2012.0,,guardian angel,antonina armato+tim james+thomas sturges+jon vella+in-q+coco jones+tyler james williams
198799,rude tube,2008.0,bad ass beasts (#8.2),blkkk skkkn head,kanye west+guy-manuel de homem-christo+thomas bangalter+cydel young+malik jones+elon rutberg+wasalu jaco+sakiya sandifer+mike dean+derrick watkins
120124,independent lens,1999.0,how to survive a plague (#15.7),soon-to-be innocent fun/lets see,arthur russell
71767,divendres,2009.0,(#7.55),amor particular,lluís llach+miquel abras+rozalén
726957,wordplay,2006.0,,it might as well be spring,richard rodgers+oscar hammerstein ii
423257,dumb and dumber to,2014.0,,too much of a good thing,bret reilly+the sons+arrangement with sony music licensing
214031,skeppsholmen,2002.0,(#1.7),jag vill nå dig (längtans samba),lillemor lill lindfors+birgitta götestam
711856,vanilla sky,2001.0,,heaven,mick jagger+keith richards+the rolling stones
369323,black rain,1989.0,,laser man,ryuichi sakamoto
407531,dead bang,1989.0,,un mundo raro,los diamantes
241221,the crazy 8 show,2014.0,the man-off (#1.8),i work alone,michael lloyd+greg oconnor
591542,reel vaudeville,1937.0,,thanks a million,arthur johnston
647708,the bank job,2008.0,,save me,steve balsamo+andy collins+the storys
97243,girlfriends guide to divorce,2014.0,rule #72: its never too late to be a mean girl (#2.5),all tied up,zachary kibbee
68346,derrick,1974.0,tod am bahngleis (#2.2),dance-dance everybody dance,junior high+the rockets
685712,the star chamber,1983.0,,boys in the brigade,
399173,country of my skull,2004.0,,lizalis idinga,princess soi-soi gqeza+mpho motheane+the new teenage gospel choir
106568,harvey birdman  attorney at law,2000.0,deadomutt: part 2 (#1.8),scoobidoo love,paul rothman
50931,country style  u.s.a.,1957.0,(#3.6),oh lonesome me,don gibson+chet atkins
190923,radio 1s big weekend norwich 2015,2015.0,jess glynne (#1.20),not letting go,jess glynne
359968,barbra: the concert,1995.0,,as if we never said goodbye,andrew lloyd webber+barbra streisand
502965,knight and day,2010.0,,lamour dun jour,josé reyes+josé reyes y los reyes
566029,one night in the tropics,1940.0,,all because you dont like mustard,
228711,suits,2011.0,mea culpa (#5.8),carry it on,racing glaciers
367687,biggles,1986.0,,knock em dead kid,mötley crüe+nikki sixx+vince neil+arrangement with warner special products
353809,asdfmovie,2008.0,,goof,alexander støver
146360,mad men,2007.0,the mountain king (#2.12),a beautiful mine,rjd2
348655,an officer and a gentleman,1982.0,,the plains of mindañao,
290439,the young and the restless,1973.0,(#1.6944),nadias theme,barry de vorzon+perry botkin jr.
500192,kid cudi: pursuit of happiness,2009.0,,pursuit of happiness,scott mescudi+ratatat+mgmt
536434,me  natalie,1969.0,,off-ramp to nowhere,henry mancini+the die-hard trippers
396176,comin thro the rye,1947.0,,charlie is my darling,sylvia welling
185140,pop idol,2001.0,live final (#2.20),on the radio,donna summer+giorgio moroder+michelle mcmanus
121830,isas stepz,2008.0,lucas flytter ind (#2.18),cha cha cha,peter biker+jan rørdam
33634,boardwalk empire,2010.0,two boats and a lifeguard (#2.8),the sheik of araby,harry b. smith+francis wheeler+ted snyder+vince giordano+his nighthawks orchestra  (as vince giordano+the nighthawks)
63389,degrassi: the next generation,2001.0,boom boom pow: part 1 (#11.1),hold on (vnnr remix),matthew herdman
683276,the searchers,1956.0,,bonnie blue flag,
387779,ceux qui maiment prendront le train,1998.0,,thats life,kelly gordon+dean kay+james brown
631842,strange interlude,1932.0,,symphony no.5 in e minor  op.64,pyotr ilyich tchaikovsky
88523,festival internacional de la canción de viña del mar,1963.0,viña 2007: noche 2,whats new pussycat,burt bacharach+lyrics by hal david+tom jones
431988,escapade in japan,1957.0,,shoes squeak,ryutaro hirota+katsura shimizu
343017,alice upside down,2007.0,,someday ill find her,christian probst+dylan mclaughlin+dale rosenbloom
297390,tohuwabohu,1990.0,36/pair/rouge (#6.10),do you wanna dance,bobby freeman+cliff richard
