id,name,year,episode,song,artist
670379,the life of the party,1930.0,,can it be possible?,archie gottler+joseph meyer
642441,thambi,2005.0,,ennamma devi jakkamma,na. muthukumar+karthik+manicka r. vinayagam+balesh
438441,feuer  eis & dynamit,1990.0,,win it all,connie de groot+harold faltermeyer+willy bogner
283414,the voice,2012.0,the battles  part 3 (#1.9),we found love,carmen smith+michelle serret-cursio+calvin harris
155220,misterogers neighborhood,1968.0,1006 (#2.6),wont you be my neighbor?,fred rogers
94653,game of thrones,2011.0,the gift (#5.7),game of thrones - main title,ramin djawadi
652278,the canyon,2009.0,,back of my mind,jim reilley+james scott reilley
730455,youre so vain  my men!! - les coquettes - ta psonia,2013.0,,h fwteini plevra tis zwis,makrina xadelfia
677636,the patriot,1986.0,,just a two beat country song,the agin brothers band
375526,brassed off,1996.0,,en aranjuez con tu amor,joaquín rodrigo
621407,solstorm,2007.0,,solstorm,jimmy lagnefors
379734,bugsy malone,1976.0,,my name is tallulah,paul williams
27037,belmonte,2013.0,(#1.188),amor com amor se paga,andré sardet
279674,the tonight show with jay leno,1992.0,(#21.76),jump,edward van halen+alex van halen+david lee roth+michael anthony+the tonight show band
430938,england made me,1973.0,,it dont mean a thing (if it aint got that swing),irving mills+duke ellington
373967,borderland,2007.0,,belly dancer,andrés levin+ileana padron+rafael robert vargas+yerbabuena+fulanito+members of gogol bordello
536648,meat loaf: live with the melbourne symphony orchestra,2004.0,,testify,k. griffin
537383,mega shark vs. giant octopus,2009.0,,cello suite no. 1 in g major  bwv 107,johann sebastian bach+tina guo
40750,californication,2007.0,the whore of babylon (#1.3),the ballad of whiskey and tears,creosote
308706,ugly betty,2006.0,the passion of the betty (#4.10),swagger rich,warren g.+snoop dogg+cassie davis
567589,original gangstas,1996.0,,aint no fun,h-town+teddy+dino conner
639621,tango,1998.0,,tango para percusión,lalo schifrin+cecilia narova+carlos rivarola
214066,skeppsholmen,2002.0,(#2.4),rock u,eric le tennen+herbie crichlow+peer stappe+supernatural
662312,the goddaughter,1972.0,,the goddaughter theme song,bob silvani
250316,the jonathan winters show,1967.0,(#1.1),beautiful things,leslie bricusse+barbara eden+dancers
258341,the o.c.,2003.0,pilot (#1.1),let it roll,maximum roach
722059,when the bough breaks,2016.0,,real love,jasmine ash+dave gulick+sunsun
594818,righteous kill,2008.0,,war,darryl pittman+tyrone smith+d/r period
548748,musical justice,1931.0,,dont take my boop-oop-a-doop away,sammy timberg+mae questel  with rudy vallee
667431,the jethro junction,1995.0,,the coffee song (theyve got an awful lot of coffee in brazil),bob hilliard+dick miles+marie murphy+her men
535395,matomena hristougenna,1951.0,,o naftis tou aigaiou,
536052,mckenna shoots for the stars,2012.0,,what a wonder (this life in color),tim myers+justin gray+arrangement with zync music group+llc
467239,heavy weights,1995.0,,le freak,bernard edwards+nile rodgers+chic+arrangement with warner special products
568736,out of rosenheim,1987.0,,zweifach,otto ebner+deihinger blasmusik
561955,o. henrys full house,1952.0,,o  little town of bethlehem,lewis h. redner
494458,joyful noise,2012.0,,(its all) amazing grace,jess rice
608112,secrets of the x files  part 2,1996.0,,my dark life,brian eno+elvis costello
597867,rogue,2007.0,,never smile at a crocodile,frank churchill+jack lawrence+the paulette sisters
225223,stargate sg-1,1997.0,evolution: part 1 (#7.11),main title,joel goldsmith+david arnold
572543,past obsessions,2011.0,,big band blast,peter allen
188954,pura química,2010.0,los auténticos decadentes (#5.5),como me voy a olvidar,los auténticos decadentes
515093,lemmings,1973.0,,lemmings lament,paul jacobs+sean kelly
236517,the art show,2002.0,stepford lives (#1.2),wishing i was lucky,wet wet wet
646168,the alien factor,1978.0,,maybe someday,lon talbot+atlantis
443102,forever fabulous,1999.0,,metti una sera a cena,ennio morricone
334197,a lonely place to die,2011.0,,by yon castle wa,heather heywood
227649,studio one,1948.0,fatal in my fashion (#7.6),introduction from ,nikolai rimsky-korsakov
273747,the tonight show starring jimmy fallon,2014.0,taraji p. henson/edward burns/sam hunt (#2.202),retreat!,bosco mann+sharon jones+the roots
223454,spongebob squarepants,1999.0,the thing/hocus pocus (#4.16),drama link (b),hubert clifford
531245,making of rockmovel,2011.0,,pior cego,luí sales jr.+rockmóvel
580958,portico,2014.0,,here we go again no stress,pamela wilder
271245,the tennessee ernie ford show,1956.0,cesar romero (#1.29),rock and roll square dance,the voices of walter schumann
510289,lady in the dark,1954.0,,the saga of jenny,kurt weill+ira gershwin+ann sothern+cast
365080,besser als nix,2014.0,,der himmel ist blau,oliver biehler+françois goeske
545267,morir en 3 actes,2011.0,,veles e vent,raimon
237063,the bad news bears,1979.0,amanda joins the bears (#1.2),carmen suite no.1 - les toreadors (main series title),georges bizet
689337,the ups and downs of a handyman,1976.0,,the ups and downs of a handyman,vic elms
614704,side by side,2012.0,,whirlaway tension,brendan ryan+bill ryan
445132,free state of jones,2016.0,,resistance by nicholas britell  tim fain (qv) shawn conley (i) (qv) & shawn pelton (qv),
405549,dark rising: bring your battle axe,2007.0,,shaketramp,josh ramsay+marianas trench
113665,house of anubis,2011.0,house of oblivion/house of snoops (#2.28),end credits theme,rob cairns+tony morales
725991,with byrd at the south pole,1930.0,,hail! hail! the gangs all here,theodore morse+arthur sullivan
306080,tsubasa kuronikuru,2005.0,nidome no kunan (#2.19),ring your song,yuki kajiura+eri itô
505733,lexplosion,1971.0,,céfalu,henri salvador
672499,the man,2015.0,,i couldnt live without your love,petula clark
572285,pas son genre,2014.0,,i will survive,dino fekaris  / freddie perren+Émilie dequenne
8956,alias,2001.0,a higher echelon (#2.11),alias theme,j.j. abrams+michael giacchino
194642,ren & stimpy adult party cartoon,2003.0,fire dogs 2: part 2 (#1.4),lambs in clover,jack strachey
145368,m*a*s*h,1972.0,death takes a holiday (#9.5),deck the halls,alan alda+mike farrell
558825,nochebuena con raphael,2006.0,,jingle bells,paloma san basilio+raphael
70420,die rudi carrell show,1965.0,grenzstation (#1.8),ja so ist das mit dem vater und dem sohn,rudi carrell+andré carrell
399207,countrys greatest stars live: vol. 1,2010.0,,it wasnt god who made honky tonk angels,j.d. miller+kitty wells
320461,wonder pets!,2006.0,happy mothers day/save the sun bear (#3.16),the wonder pets! theme (instrumental),the wonder pets orchestra
93966,fushigi no umi no nadia,1990.0,the new nautilus (#1.36),yes  i will...,miho morikawa+joe rinoie
602162,saimaa-ilmiö,1981.0,,luonas kai olla saa,juice leskinen+juice leskinen slam
733300,¡a por ellos...! que son pocos y cobardes,1989.0,,cadillac solitario,sabino méndez+loquillo y trogloditas
514905,legion,2010.0,,achilles - the breakdown,the showdown+david edison bunton+joshua michael childers+andrew joseph barnette+eric allen koruschak
688237,the tree of life,2011.0,,my country - vltava (the moldau),bedrich smetana+václav smetácek+ceská filharmonie
188694,psych,2006.0,high top fade out (#4.7),i know you know,steve franks+boys ii men
201859,saturday night live,1975.0,elliott gould/anne murray (#1.9),the call,gene maclellan+anne murray
53850,curious george,2006.0,curious george and the invisible sound/curious george  a peeling monkey (#1.8),curious george main title theme,dr. john+rocco gagliese+steve dangelo+terry tompkins
200948,saramandaia,1976.0,,pavão mysteriozo,ednardo
264280,the ren & stimpy show,1991.0,its a dogs life/egg yolkeo (#4.7),rule britannia,thomas augustine arne
702050,trap,2006.0,,magic forest,necroluter
119055,idool 2007,2007.0,grote liveshow 1 - mijn idool (#3.11),mr. jones,david bryson+adam duritz+charles gillingham+matthew malley+ben mize+dan vickrey+tom de bie
387547,cementerio general 2,2015.0,,you can not hide,jorge luís cárdenas sotolongo
322307,yo gabba gabba!,2007.0,together (#1.13),yo gabba gabba closing theme,dj lance+various artists+adam deibert+jarond gibbs
158547,moonlighting,1985.0,between a yuk and a hard place (#5.2),laras theme,maurice jarre
541065,milk punch,2000.0,,big city blues,
56920,dancing stars,2005.0,(#6.8),the mambo craze,dancing stars live-orchestra
427130,el exilio de gardel: tangos,1985.0,,vals del regreso,josé luis castiñeira de dios+susana lago
396959,con la muerte en los 2 tacones,2009.0,,dustsucker,jens kiilstofte
442880,for the love of mike,1932.0,,valse des rayons,jacques offenbach
259368,the oprah winfrey show,1986.0,oprahs 50th birthday bash!,proud mary,john fogerty+tina turner
175185,operación triunfo,2001.0,gala 0 (#6.1),smile,charles chaplin+virginia maestro
76502,dream girl of 67,1966.0,the dream girl of 1967 (show 12) (#1.12),pretty girl (the theme of the dream girl of 1967),
285868,the x factor,2004.0,(#5.13),the way you make me feel,michael jackson+jls
362967,bed of roses,1996.0,,ding  ding  merrily...,
467249,heavyweight,2015.0,,victim,health
652392,the carol project,2006.0,,wings of the wind,
729829,you cant play the game if you dont know the rules,2017.0,,party at the ritz,rick ivanoff
462735,halvveis til haugesund,1997.0,,handclapping time,the fabulous raiders
79865,edición especial coleccionista,2010.0,underground (#5.10),turkish march,ludwig van beethoven
22290,banda sonora,2007.0,(#5.24),caruso,lucio dalla
19911,avenida brasil,2012.0,(#1.144),infiltrado,bajofondo  bajo fondo tango club
706484,u2: numb,1993.0,,numb,u2
365307,best of cmt music awards,2009.0,,before he cheats,carrie underwood
488780,j-men forever,1979.0,,wide stride,billy preston
566407,one in a million,1936.0,,the moonlit waltz,lew pollack
543053,model shop,1969.0,,mellow fellow,ed cassidy+jay ferguson+john locke+mark andes+randy california+spirit
617406,sixteen candles,1984.0,,kajagoogoo,kajagoogoo
292634,the young and the restless,1973.0,(#1.9539),nadias theme,barry de vorzon+perry botkin jr.
304652,trailer park boys,2001.0,shit covered cave teeth (#10.4),honky tonk barstool,zach selwyn+zachariah+the lobos riders
246647,the good wife,2009.0,fleas (#1.16),the good wife theme,david buckley
213072,sinungaling mong puso,2016.0,jason ay aguirre (#1.37),natatanging pag-ibig,maricris garcia
602188,saint jack,1979.0,,someday youll be sorry,louis armstrong
731130,yu-gi-oh!: the other abridged movie,2008.0,,feuer frei!,rammstein
276276,the tonight show starring johnny carson,1962.0,(1984-02-09),johnnys theme,paul anka
313472,vikings,2013.0,treachery (#2.3),if i had a heart,karin dreijer andersson+fever ray
641980,terra estrangeira,1995.0,,estranha forma de vida,
696016,three wishes,1989.0,,pat-a-cake,
401679,cuando acaba la noche,1950.0,,amorcito corazón,manuel esperón+pedro de urdimalas
413121,dhiyan namanian,1973.0,,maida ishq wee tuun  maida iman wee tuun,inayat hussain bhatti
239293,the blacklist,2013.0,the longevity initiative (no. 97) (#2.17),baby thats not all,josh ritter
278246,the tonight show with jay leno,1992.0,(#20.150),king of pain,sting+the tonight show band
282465,the voice uk,2012.0,blind auditions 2 (#1.2),pump it,nicholas roubanis+fergie+thomas van musser+will.i.am+apl.de.ap+the black eyed peas+dick dale
578837,plunkett & macleane,1999.0,,hypnotic,craig armstrong
200457,sally and chica,2012.0,the dexter team (#4.2),corporation motivation,jason shaw
74547,dora the explorer,2000.0,quack! quack! (#2.22),travel song medley,harrison chad+kathleen herles
52231,cristina,1989.0,una ragazza ideale (#1.26),cristina,carmelo carucci+cristina davena
606026,scary normal,2013.0,,right back,larry e. gates ii
20614,awkward.,2011.0,taking sides (#3.13),the dark age,widowspeak
288403,the young and the restless,1973.0,(#1.10032),nadias theme,barry de vorzon+perry botkin jr.
236277,the angry beavers,1997.0,gift hoarse/go beavers! (#1.3),take me out to the ball game,jack norworth+albert von tilzer
184755,polizeiruf 110,1971.0,eifersucht (#18.5),als ich fortging,dirk michaelis+dirk michaelis / gruppe karussell
32398,blues clues,1996.0,blues sad day (#2.14),we just got a letter,steven burns
228156,submissions only,2010.0,yore so bad (#1.4),i could be your person b,devon goffman+michael croiter
4596,90210,2008.0,all about a boy (#3.14),story for children,pierre arachart+rudy kahn+anton nevski
729666,you again,2010.0,,whos sorry now,bert kalmar+harry ruby+ted snyder+connie francis
181772,ping qiong gui gong zi,2001.0,,i wanna hold your hand,john lennon+paul mccartney+dragon 5
614130,shunned,2014.0,,against the tide,diwa de leon
734242,É de chuá,1958.0,,você é demais,sebastião gomes+braga filho+gilberto alves
120326,independent lens,1999.0,off the charts: the song-poem story (#4.2),human breakdown of absurdity,lew tobin+norm burns+singers
6760,a Única mulher,2015.0,(#3.42),Única mulher,anselmo ralph
365566,bette midler in concert: diva las vegas,1997.0,,infomercial,bette midler
453990,god and gays: bridging the gap,2006.0,,facing fears,valerie joi fiddmont
61435,dawsons creek,1998.0,the kids are alright (#6.1),slide,sci-fi lullaby
723477,who killed the electric car?,2006.0,,govern mental,james lumb  / electric skychurch
392995,ciudades gallegas,1956.0,,popular galician music,music asessor: antonio iglesias
451550,ghosts of the abyss,2003.0,,underwater waltz,anatoly m. sagalevitch
3693,7th heaven,1996.0,gabrielle come blow your horn (#7.7),7th heaven,dan foliart+steve plunkett
114380,how i met your mother,2005.0,the broath (#7.19),hey beautiful,the solids
35030,braindead,2016.0,talking points toward a wholistic view of activism in government: can the top rebel? (#1.12),we shall not be moved,braindead cast
175983,oswald,2001.0,daisy plays an instrument/the ball of yarn,oswald closing theme,
623282,sonne über der adria,1954.0,,verlieb dich noch heut!,peter igelhoff+rene carol
109022,heroes,2006.0,chapter three one giant leap (#1.3),hiros theme,wendy melvoin+lisa coleman
484162,in the aleutians,1945.0,,jingle bells,james pierpont
8105,agents of s.h.i.e.l.d.,2013.0,a fractured house (#2.6),agents of s.h.i.e.l.d. theme song,bear mccreary
284178,the waltons,1971.0,the outsider (#7.20),sweet georgia brown,ben bernie+maceo pinkard+kenneth casey
651703,the bullfighters,1945.0,,how dry i am,
699447,tony hawks pro skater 4,2002.0,,shimmy,system of a down+john dolmayan+daron malakian+shavo odadjian+serj tankian
256585,the morey amsterdam show,1948.0,(#3.20),yuk-a-puk,morey amsterdam+don russell
225106,stargate sg-1,1997.0,1969 (#2.21),end title,joel goldsmith
463626,happy 40th,2015.0,,only my heart,julia darling
313476,vikings,2013.0,trial (#1.4),vikings end credits theme,trevor morris
454011,god of war iii,2010.0,,the great machine,michael a. reagan
99515,go  diego! go!,2005.0,diegos orangutan rescue (#5.6),rescue pack,keeler sandhaus
491187,jekyll & hyde: the musical,2001.0,,facade reprise 2,leslie bricusse+frank wildhorn+company
710038,up in the air,2009.0,,mood indigo,barney bigard+duke ellington+irving mills+thelonious monk
566281,one way out,1955.0,,dramatic story,charles williams
351951,apolônio brasil  campeão da alegria,2003.0,,outra vez nunca mais,abel silva+sueli costa+marco nanini
379740,bugsy and mugsy,1957.0,,jimmy valentine,gus edwards
481405,ice age: dawn of the dinosaurs,2009.0,,youll never tango,john powell
209043,sharon  lois & brams elephant show,1984.0,funny field day (#2.14),i had a little friendship ring,
337247,a.c.o.d.,2013.0,,ashamed,john joseph mccauley iii+deer tick+arrangement with terrorbird media
336595,a very murray christmas,2015.0,,christmas baby please come home,jeff barry+ellie greenwich+phil spector+maya rudolph
574798,peripheral vision,2008.0,,pain,the fabulous custodians+tony loguercio
402895,dj snake and lil jon: turn down for what,2014.0,,turn down for what,martin bresso+dj snake+lil jon
57986,dancing with the stars,2004.0,2012 semi-final (#12.9),jet lag,pierre bouvier+chuck comeau+david desrosiers+jeff stinco+sebastien lefebvre+nolan sipe+ryan petersen
281317,the vampire diaries,2009.0,ill remember (#6.1),doses & mimosas,cherub
502294,kiss them for me,1957.0,,stompin at the savoy,benny goodman+chick webb+edgar m. sampson
688308,the trials of darryl hunt,2006.0,,happy day,andrew bird
618385,slaughters big rip-off,1973.0,,how long can i keep it up,lyn collins
604930,savage harvest,1981.0,,all you need is love,john lennon+paul mccartney
546888,mr. nobody,2009.0,,what power art thou,henry purcell
53447,curb your enthusiasm,2000.0,the lefty call (#6.4),the little people,carlo rustichelli
407329,de röda hästarna,1954.0,,new highway,frank tapp
302279,top of the pops,1964.0,(1994-12-01),love spreads,john squire+the stone roses
221548,spongebob squarepants,1999.0,captain spongebob/patrick got the flu (#9.3)} {{suspended},spongebob squarepants closing theme,the blue hawaiians+bikini bottom band
116309,ideal,2005.0,the lapse (#6.5),lean,virtu-oso a.k.a v-man
538214,men without law,1930.0,,im an old cowhand,syd saylor
509967,ladies and gentlemen: the rolling stones,1973.0,,you cant always get what you want,mick jagger+keith richards+the rolling stones
704101,try seventeen,2002.0,,alley cat,robin l. klein+scott schreer
138586,life on mars,2008.0,tuesdays dead (#1.6),were an american band,grand funk railroad
468553,her cardboard lover,1942.0,,frühlingslied (spring song) op.62 #6,felix mendelssohn-bartholdy
428682,eliana: diga sim,2004.0,,diga sim,eliana
634392,sunbonnet sue,1945.0,,roll dem bones,
339916,addicted to porn: chasing the cardboard butterfly,2016.0,,coming home,freak iv+ash casteel
6239,a woman of substance,1984.0,(#1.3),take a pair of sparkling eyes,w.s. gilbert+arthur sullivan   (as gilbert+sullivan)+christopher gable
306141,tsukuyomi: moon phase,2004.0,yahho! haihô! ima  ai ni yukimasu ne (#1.18),kanashii yokan,
454360,going home,1971.0,,rope around the wind,red lane+larry henley
288462,the young and the restless,1973.0,(#1.10083),nadias theme,barry de vorzon+perry botkin jr.
94539,galavant,2015.0,the one true king (to unite them all) (#2.10),a real life  happily ever after,alan menken+joshua sasse+karen david
711614,vampyres,1974.0,,the legend of the house,james kenelm clarke+james clarke orchestra
658821,the eyes of charles sand,1972.0,,wait until dark,henry mancini
275944,the tonight show starring johnny carson,1962.0,(1979-09-10),johnnys theme,paul anka
259041,the office,2005.0,lice (#9.10),girls just want to have fun,robert hazard+jenna fischer+kate flannery
222632,spongebob squarepants,1999.0,pizza delivery/home sweet pineapple (#1.5),south sea island lullaby,george elliot
174660,ookiku furikabutte,2007.0,gyakuten (#1.20),arigatou,sunsetswish
444255,frank sinatra: a man and his music part ii,1966.0,,thats life,dean kay+kelly gordon+frank sinatra
552712,nandha,2001.0,,maayane andha,aandaal+raja lakshmi+madhumita+ganga+fegi+kanchana+febi mani+charulatha mani
699761,too much harmony,1933.0,,the two aristocrats,arthur johnston+sam coslow
568314,our funny finny friends,1949.0,,three little fishies,the smoothies
63710,degrassi: the next generation,2001.0,father figure: part 1 (#3.1),chameleon,michèle vice-maslin+matthew gerrard+wanda bell
106743,hatfields & mccoys,2012.0,(#1.3),i know these hills,kevin costner+park chisolm+teddy morgan+sara beck with modern west
561419,o bem amado,2010.0,,cajazeira tentação,berna ceppas
198655,rupauls drag race,2009.0,shade: the rusical (#6.4),im every woman,nick ashford+valerie simpson+chaka khan
61778,de mike burstyn show,1978.0,(#2.1),the impossible dream,mitch leigh+lyrics by joe darion+mike burstyn
488471,its the great pumpkin  charlie brown,1966.0,,pack up your troubles in your old kit bag and smile  smile  smile!,felix powell
441440,flor de durazno,1945.0,,flor de durazno,ernesto cortázar+felipe bermejo
627280,squatters,2014.0,,knut,craig b.+iain cook+the unwinding hours
106426,happy town,2010.0,in this home on ice (#1.1),across the sea,samantha shelton+noah warner
151303,memòries de la tele,2007.0,(#1.9),maquillaje,nacho cano+mecano
665143,the hollars,2016.0,,in the dark,
225682,starmyu,2015.0,act 7 (#1.7),star of stars!,masahiro kawaura+nobuhiko okamoto+yuma uchida+kazuyuki okitsu+yoshitsugu matsuoka+kenn
118325,idols,2002.0,top 24: group 3 (#3.9),wrap my words around you,daniel bedingfield+tats nkonzo
149721,masters snooker,1975.0,2016: day 8  part 2,my love,kele le roc
424636,easy a,2010.0,,dont cha,sir mix a lot+ceelo green+busta rhymes+the pussycat dolls
521844,lola torbellino,1956.0,,tus ojos,agustín lara+lola flores+by luis aguilar
720769,what price glory,1952.0,,smiles,lee s. roberts+sung in the background when sgt. quirt returns
494919,jukebox rock n roll vol. 1,2007.0,,peggy sue,buddy holly+jerry allison+norman petty
104586,guapas,2014.0,la tormenta (#1.103),i love it,charlotte aitchison+patrik berger+linus eklöw+ebony day
129126,kinderen voor kinderen,1980.0,kinderen voor kinderen 23 (#23.1),bas,kinderen voor kinderen  koor
266924,the shield,2002.0,homewrecker (#2.6),the shield theme,vivian romero+ness bautista+rodney alejandro
564353,oliver!,1968.0,,boy for sale,harry secombe
709813,untied,2012.0,,invisible cars 1,thomas faustin huisking
62181,de lachende scheerkwast,1981.0,stenen op het strand (#1.6),een lied van verlangen,clous van mechelen+mimi kok
20894,bbc look north: yorkshire and north midlands,1968.0,(2010-09-20),mark,shed seven
302925,top of the pops,1964.0,(1998-01-30),angels,robbie williams
24825,beauty and the beast,2012.0,unbreakable (#3.11),curtains!?,timber timbre
263095,the red skelton show,1951.0,freddie and the yuletide doll (#11.13),when you wish upon a star,ned washington+leigh harline+the robert mitchell boy choir
274565,the tonight show starring johnny carson,1962.0,(1970-09-02),johnnys theme,paul anka
335634,a shtetl in the caribbean,2014.0,,a shtetl in the caribbean,randal corsen+the matangi string quartet.
446278,frisson des collines,2011.0,,blue jeans sur la plage,claude dominique+louise rousseau+les hou-lops
352789,arise sweet sarah,2015.0,,baby not okay,al babyok
291166,the young and the restless,1973.0,(#1.8155),nadias theme,barry de vorzon+perry botkin jr.
459275,grind,2003.0,,these walls,chris taylor brown+peter charell+simon ormandy+trapt+arrangement with warner strategic marketing
598041,rollcage,1999.0,,feel,ben petit+freestylers
690512,the way we werent,,,you can have it all,jeff desira
62895,deadwood,2004.0,deep water (#1.2),row row row your boat,unknown+robin weigert
67232,deixa-me amar,2007.0,(#1.73),tu pertences a mim,os azeitonas
492233,jimmy buffett: scenes you know by heart,2009.0,,he went to paris,jimmy buffett+the coral reefer band
699236,tomorrow youre gone,2012.0,,mama,erik donley+ethan donley+rhys detrow+dandelo
98277,glee,2009.0,a katy or a gaga (#5.4),time for some girl talk,james s. levine
592819,research: the musical,2011.0,,devin and lauren break-up,john pasternak+aungelique scott+gregory grimes
423100,dulaara,1994.0,,saajan re saajan  kehta hai sawan,nikhil+vinay
630140,stephen lynch: live at the el rey,2004.0,,superhero,stephen lynch
557651,nitrato dargento,1996.0,,kicsi vagyok en,tibor lugosi
216827,so you think you can dance,2005.0,the top eight perform (#6.21),i got the feelin,james brown
605258,saved!,2004.0,,what if god fell from the sky,gregg alexander+danielle brisebois
571313,paragraph 175,2000.0,,falling in love again,friedrich hollaender+marlene dietrich
180006,pawn stars,2009.0,poker night (#4.53),united states national anthem,
476781,howard the duck,1986.0,,dont turn away (reprise),thomas dolby+allee wills+lea thompson+holly robinson peete+dominique davalos+liz sagal
599163,rosewood lane,2011.0,,hickory dickory dock,oliver goldsmith
532944,manna from heaven,2002.0,,wiener blut op. 354,johann strauss+buffalo philharmonic orchestra
716175,waffle street,2015.0,,conga line,michael lee bishop
278049,the tonight show with jay leno,1992.0,(#20.116),25 or 6 to 4,robert lamm+the tonight show band
563076,october moon,2005.0,,the prodigal,sacha sacket+sacha sacket  from the album shadowed
592137,remembering mel,1984.0,,sexual outlaw,carole pope
671514,the lost,2006.0,,time to retire,don piper
9241,alias,2001.0,truth be told (#1.1),no mans woman,
510989,lang historie kort,2015.0,,arrabal amargo,carlos gardel
139870,live life and win!,2011.0,golf  dancing queen  going green (#1.2),extraordinary,carl mcgregor+jerohn mcgregor+tom valdez+janet cole valdez+deedee omalley
98936,glee,2009.0,saturday night glee-ver (#3.16),night fever,barry gibb+robin gibb+maurice gibb+matthew morrison+the cast of glee
661764,the girl cant help it,1956.0,,i aint gonna cry no more,johnny olenn+the jokers
131101,kyle xy,2006.0,sleepless in seattle (#1.2),sunday morning blues,waking eyes
223987,squidbillies,2005.0,take this job and love it (#1.2),squidbilles theme,dave willis+jim fortier+billy joe shaver+david lee powell+kristofer dale+ron benner
498356,katamari damashii tribute,2009.0,,the moon & the prince,music: nbgi  )
116411,idol - jakten på en superstjerne,2003.0,topp 12 - ditt idol (#4.8),the reason,douglas robb+daniel estrin+chris hesse+markku lappalainen+audun rensel
403273,daddys home,2015.0,,the princess bride score,mark knopfler
731974,zhara,2006.0,,moskva,dato evgenidze
434416,exit wounds,2001.0,,the fun lovin criminal,fun lovin criminals
370799,blood diamond,2006.0,,when i get free,tupac shakur+malcolm greenidge+katari cox+ricky rouse+j. valentine
632953,stuck in the past,2007.0,,dig a little deeper,dave moody+josh moody+leslie bowen+sherri bohlander
